{
  "command": "python3 -I -S host/record-deepseek-lab.py --run <private-bundle> --receipt-sha256 <digest> --weights <private-weights> --output <private-evidence> --deadline <approved-UTC-cutoff>",
  "ended_utc": "2026-10-24T13:38:44Z",
  "execution": "hardware",
  "git_sha": "5b4e2f54f2b9c14ff46fb9c1efcfbcdbf37b49f1",
  "hardware_validated": false,
  "host": {
    "cuda": "13.0",
    "driver": "580.178.04",
    "gpus": "eight-selected-B300",
    "machine": "approved-isolated-lab",
    "provider": "spheron"
  },
  "notes": "Partial Spheron functional experiment, not GCP gates or full P2 acceptance. Candidate BLOCKED; deployable=false; confidential=false; no attestation or ABI qualification. Generated JIT code is private output, not verified native provenance. CUDA field is the observed driver-supported CUDA API version, not a runtime measurement. Explicit nonconfidential baseline; CC-disabled observations are not confidential evidence.",
  "phase": "P2",
  "result": "fail",
  "schema": "nib.evidence/v1",
  "started_utc": "2026-10-24T13:18:07Z",
  "task": "T3"
}
