{
  "command": "go run ./models/packcheck check",
  "ended_utc": "2026-10-19T01:53:01.57203Z",
  "execution": "software",
  "git_sha": "230be00ce728316f9f1cf8ffbb95356b51a60025",
  "hardware_validated": false,
  "host": {
    "cuda": null,
    "driver": null,
    "gpus": "none",
    "machine": "darwin/arm64",
    "provider": "local"
  },
  "notes": "Public metadata only. LFS hashes are remote assertions, not downloaded weight verification. Empty verity roots remain non-deployable. No credentials supplied; registry tokens are anonymous public pull tokens kept in memory.",
  "phase": "P0",
  "result": "pass",
  "schema": "nib.evidence/v1",
  "started_utc": "2026-10-19T01:52:47.853577Z",
  "task": "T4"
}
