{"command":"python3 -I -S -B scripts/record-tau-selected.py --gpu-bundle PRIVATE --gpu-receipt-sha256 DIGEST --weights PRIVATE --cpu-inputs PRIVATE --source-archive PRIVATE --wheelhouse PRIVATE --output PRIVATE --deadline UTC","ended_utc":"2026-10-25T11:37:54Z","execution":"hardware","git_sha":"975738d7eb26e3d315a41857ece0d70d757db4ab","hardware_validated":false,"host":{"cuda":"13.0","driver":"580.178.04","gpus":"eight-selected-B300","machine":"approved-selected-operational-lab","provider":"local"},"notes":"One fixed operational task, selected checkpoint with small CPU support models. GPU lab qualification remains FAIL/BLOCKED even when this operational trial passes. Not a full tau benchmark or comparable quality score. No pricing, production admission or confidentiality claim. Driver and CUDA facts, when present, are joined from the original GPU owner report; CUDA is the driver-supported API version, not a runtime measurement.","phase":"P2","result":"fail","schema":"nib.evidence/v1","started_utc":"2026-10-25T11:17:59Z","task":"T4"}
