{
  "command": "host/run-mkosi-build.py --downloads PRIVATE --archive PRIVATE --output PRIVATE --compile-driver",
  "ended_utc": "2026-10-22T00:13:41Z",
  "execution": "software",
  "git_sha": "c70b1b7a60ed223ead65e12642fc368838244997",
  "hardware_validated": false,
  "host": {
    "cuda": null,
    "driver": null,
    "gpus": "none",
    "machine": "ubuntu-22.04-x86_64",
    "provider": "github-actions"
  },
  "notes": "Bounded offline installation and explicit DKMS build; no module loading, boot, LKCA, reproducibility or hardware qualification.",
  "phase": "P3",
  "result": "pass",
  "schema": "nib.evidence/v1",
  "started_utc": "2026-10-22T00:10:23Z",
  "task": "T1"
}
