{
  "command": "/usr/bin/python3.10 -I -S -B host/probe-mkosi-native.py --archive PRIVATE --output PRIVATE",
  "ended_utc": "2026-10-21T14:07:55Z",
  "execution": "software",
  "git_sha": "6e864bebbb123a79f063ca562bcd686b8ab5365c",
  "hardware_validated": false,
  "host": {
    "cuda": null,
    "driver": null,
    "gpus": "none",
    "machine": "ubuntu-22.04-x86_64",
    "provider": "github-actions"
  },
  "notes": "Pinned mkosi sandbox and synthetic checker on an unprivileged ephemeral runner. The runner kernel, Python and userspace are not pinned build inputs. No package installation, image build, boot or attestation. No host security changes.",
  "phase": "P3",
  "result": "pass",
  "schema": "nib.evidence/v1",
  "started_utc": "2026-10-21T14:07:55Z",
  "task": "T1"
}
