{"command":"python3 -I -S -B scripts/record-tau-sequential-offline.py --source-archive PRIVATE --wheelhouse PRIVATE --docker-socket PRIVATE --output PRIVATE --receipt PRIVATE --domain airline","ended_utc":"2026-10-27T18:15:10Z","execution":"software","git_sha":"a52207581d25abbfb2f2841d814c0caa276aebf2","hardware_validated":false,"host":{"cuda":null,"driver":null,"gpus":"none","machine":"network-disabled-sequential-replay","provider":"local"},"notes":"Original pinned airline worker and serial controller; fixed peers and synthetic counts only. Not quality, measured parity, billing proof, live admission or full tau. Original failed and successful receipts and journals retained without rewriting producer bytes.","phase":"P2","result":"pass","schema":"nib.evidence/v1","started_utc":"2026-10-27T18:10:28Z","task":"T3"}
