{
  "command": "python3 -I -S record-stage.py run --download --seconds 10800 --max-bytes 510311045378 --receipt-sha256 968fd5fbca2b8de4862d84ab22c65584744fa19fa35c72a6cfffbc20d16941d5 --workers 8 --destination <private> --evidence <private>",
  "ended_utc": "2026-10-21T19:03:50Z",
  "execution": "software",
  "git_sha": "212559364d78fafe74c98113038646069e6621f4",
  "hardware_validated": false,
  "host": {
    "cuda": null,
    "driver": null,
    "gpus": "not-used",
    "machine": "linux-amd64",
    "provider": "operator-approved-test-host"
  },
  "notes": "Pinned public byte staging only; no engine launch, immutable volume, attestation or runtime readiness. Trusted offline builder receipt SHA-256: 968fd5fbca2b8de4862d84ab22c65584744fa19fa35c72a6cfffbc20d16941d5. Progress is unverified metadata, not transfer or integrity proof. Process bounds do not delete a rented machine or stop billing. Complete model files are retained; no wildcard cleanup.",
  "phase": "P0",
  "result": "pass",
  "schema": "nib.evidence/v1",
  "started_utc": "2026-10-21T18:20:35Z",
  "task": "T4"
}
