{"command":"Bounded external tau trial; private endpoint and credential paths omitted.","ended_utc":"2026-10-27T18:01:08Z","execution":"software","git_sha":"6a8a4f5f18163612d89bce367912994c37c83792","hardware_validated":false,"host":{"cuda":null,"driver":null,"gpus":"none","machine":"isolated-linux-amd64-container","provider":"local"},"notes":"Original upstream task/scorer with separately metered endpoints. A lifecycle pass is not a task success or full benchmark qualification. Preflight failures lack usage observations. No confidential claim. output.log contains numeric/fixed observations only.","phase":"P2","result":"pass","schema":"nib.evidence/v1","started_utc":"2026-10-27T18:00:53Z","task":"T3"}
