{
  "command": "python3 -I -S -B scripts/record-tau-cpu-parity.py --archive PRIVATE --model-06 PRIVATE --model-17 PRIVATE --cmake-wheel PRIVATE --output PRIVATE --selected-owner",
  "ended_utc": "2026-10-25T03:53:09Z",
  "execution": "software",
  "git_sha": "71d28f9fa97bab1cbfd176d1559963f80541c663",
  "hardware_validated": false,
  "host": {
    "cuda": null,
    "driver": null,
    "gpus": "none",
    "machine": "owned-linux-amd64-container",
    "provider": "local"
  },
  "notes": "Measured CPU owner and explicit finish acknowledgement only. No target quality, live admission or confidential claim.",
  "phase": "P2",
  "result": "fail",
  "schema": "nib.evidence/v1",
  "started_utc": "2026-10-25T03:33:49Z",
  "task": "T3"
}
